movieId,title,genres,directors,actors,overview,voteAverage
216,Billy Madison,['Comedy'],['Tamra Davis'],"['Adam Sandler', 'Darren McGavin', 'Bridgette Wilson-Sampras']","In order to inherit his fed-up father Brian's hotel empire, immature and lazy Billy Madison must repeat grades one through twelve all over again. The further Billy progresses, the harder his hated rival Eric Gordon tries to stop him.",6.4
217,The Babysitter,"['Drama', 'Thriller']",['Guy Ferland'],"['Alicia Silverstone', 'Jeremy London', 'J.T. Walsh']",A teenage babysitter is the focus of two boys and a man's separate obsessions.,4.3
218,Boys on the Side,"['Comedy', 'Drama']",['Herbert Ross'],"['Whoopi Goldberg', 'Mary-Louise Parker', 'Drew Barrymore']","Robin shares a ride in her car with Jane from New York to Los Angeles. They stop at Jane's friend Holly's place in Pittsburgh and take her with them west, making a long stop in Tucson. The three very different women become close f...",6.5
219,The Cure,"['Adventure', 'Drama']",['Peter Horton'],"['Joseph Mazzello', 'Brad Renfro', 'Aeryk Egan']","Erik, a loner, finds a friend in Dexter, an eleven-year-old boy with AIDS. They vow to find a cure for AIDS together and save Dexter's life in an eventful summer.",7.7
220,Castle Freak,"['Drama', 'Horror', 'Mystery', 'Thriller']",['Stuart Gordon'],"['Jeffrey Combs', 'Barbara Crampton', 'Jonathan Fuller']",A man struggles to save his family from the strange and deadly occurrences in the castle they've inherited.,6.0
222,Circle of Friends,"['Drama', 'Romance']","[""Pat O'Connor""]","[""Chris O'Donnell"", 'Minnie Driver', ""Geraldine O'Rawe""]","Three women, who've been friends since childhood, meet at university in Dublin in 1957. Student and boyfriend life begins.",6.6
223,Clerks,['Comedy'],['Kevin Smith'],"[""Brian O'Halloran"", 'Jeff Anderson', 'Marilyn Ghigliotti']","A day in the lives of two convenience clerks named Dante and Randal as they annoy customers, discuss movies, and play hockey on the store roof.",7.7
224,Don Juan DeMarco,"['Comedy', 'Drama', 'Romance']",['Jeremy Leven'],"['Johnny Depp', 'Marlon Brando', 'Faye Dunaway']","A psychiatrist must cure a young patient who presents himself as Don Juan, the world's greatest lover.",6.7
225,Disclosure,"['Drama', 'Thriller']",['Barry Levinson'],"['Michael Douglas', 'Demi Moore', 'Donald Sutherland']","A computer specialist is sued for sexual harassment by a former lover turned boss who initiated the act forcefully, which threatens both his career and his personal life.",6.2
227,Drop Zone,"['Action', 'Adventure', 'Thriller']",['John Badham'],"['Wesley Snipes', 'Gary Busey', 'Yancy Butler']",A tough cop teams up with a professional skydiver to capture a renegade computer hacker on the run from the law.,5.6
228,Destiny Turns on the Radio,"['Crime', 'Comedy', 'Fantasy']",['Jack Baran'],"['Dylan McDermott', 'Nancy Travis', 'Quentin Tarantino']","After 3 years in prison, Julian breaks out and returns to Vegas to get his half from the bank robbery and see Lucille again. The Devil took the loot and Tuerto took Lucille.",4.5
229,Death and the Maiden,"['Drama', 'Mystery', 'Thriller']",['Roman Polanski'],"['Sigourney Weaver', 'Ben Kingsley', 'Stuart Wilson']",A political activist is convinced that her guest is a man who once tortured her for the government.,7.2
230,Dolores Claiborne,"['Crime', 'Drama', 'Mystery']",['Taylor Hackford'],"['Kathy Bates', 'Jennifer Jason Leigh', 'Christopher Plummer']",A big city reporter travels to a small town where her mother has been arrested for the murder of an elderly woman for whom she worked as a housekeeper.,7.4
231,Dumb and Dumber,['Comedy'],"['Peter Farrelly', 'Bobby Farrelly']","['Jim Carrey', 'Jeff Daniels', 'Lauren Holly']","After a woman leaves a briefcase at the airport terminal, a dumb limo driver and his dumber friend set out on a hilarious cross-country road trip to Aspen to return it.",7.3
232,Eat Drink Man Woman,"['Comedy', 'Drama', 'Romance']",['Ang Lee'],"['Sihung Lung', 'Kuei-Mei Yang', 'Wang Yu-wen']",A senior chef lives with his three grown daughters; the middle one finds her future plans affected by unexpected events and the life changes of the other household members.,7.8
233,Exotica,['Drama'],['Atom Egoyan'],"['Bruce Greenwood', 'Elias Koteas', 'Don McKellar']","A man plagued by neuroses frequents the club Exotica in an attempt to find solace, but even there his past is never far away.",7.0
234,Exit to Eden,"['Comedy', 'Crime', 'Romance']",['Garry Marshall'],"['Dana Delany', 'Dan Aykroyd', ""Rosie O'Donnell""]","Elliot heads for the sexual fantasy island, Eden. He takes some photos of diamond smugglers. They and undercover cops want the photos and follow him to Eden.",4.3
235,Ed Wood,"['Biography', 'Comedy', 'Drama']",['Tim Burton'],"['Johnny Depp', 'Martin Landau', 'Sarah Jessica Parker']",Ambitious but troubled movie director Edward D. Wood Jr. tries his best to fulfill his dreams despite his lack of talent.,7.8
236,French Kiss,"['Comedy', 'Drama', 'Romance']",['Lawrence Kasdan'],"['Meg Ryan', 'Kevin Kline', 'Timothy Hutton']",A woman flying to France to confront her straying fiance gets into trouble when the charming crook seated next to her uses her for smuggling.,6.6
237,Forget Paris,"['Comedy', 'Romance']",['Billy Crystal'],"['Billy Crystal', 'Debra Winger', 'Joe Mantegna']","Mickey, an NBA referee, meets Ellen, an American airline official, in Paris. It develops into a relationship of ups and downs.",6.5
238,Far from Home: The Adventures of Yellow Dog,"['Adventure', 'Family']",['Phillip Borsos'],"['Jesse Bradford', 'Mimi Rogers', 'Bruce Davison']","Angus McCormick adopts a stray dog and names him Yellow. Several days later, while traveling along the coast of British Columbia with his father, John, he and Yellow become stranded when turbulent waters capsize their boat. John a...",6.3
239,A Goofy Movie,"['Animation', 'Adventure', 'Comedy']",['Kevin Lima'],"['Bill Farmer', 'Jason Marsden', 'Jim Cummings']","When Max makes a preposterous promise to a girl he has a crush on, his chances to fulfilling it seem hopeless when he is dragged onto a cross-country trip with his embarrassing father, Goofy.",6.9
240,Hideaway,"['Fantasy', 'Horror', 'Thriller']",['Brett Leonard'],"['Jeff Goldblum', 'Christine Lahti', 'Alicia Silverstone']","Family man Hatch Harrison gets a special resuscitative medicine after ""dying"" in a car accident. Afterwards, he starts having strange nightmares such as killing a teen girl. Is it just dreams?",5.3
241,Fluke,"['Drama', 'Family', 'Fantasy']",['Carlo Carlei'],"['Matthew Modine', 'Nancy Travis', 'Samuel L. Jackson']","After a man dies in a car crash, he is reincarnated as a dog and attempts to reconnect with his family.",6.6
242,Farinelli,"['Biography', 'Drama', 'Music']",['Gérard Corbiau'],"['Stefano Dionisi', 'Enrico Lo Verso', 'Elsa Zylberstein']","The story of castrato opera singer Carlo Broschi, who enthralled 18th-century European audiences under his stage name Farinelli.",6.8
243,Gordy,"['Comedy', 'Drama', 'Family']",['Mark Lewis'],"['Kristy Young', 'Doug Stone', 'James Donadio']",A talking pig named Gordy becomes involved in a quest to save his family from the slaughterhouse.,3.8
246,Hoop Dreams,"['Documentary', 'Drama', 'Sport']",['Steve James'],"['William Gates', 'Arthur Agee', 'Emma Gates']",A film following the lives of two inner-city Chicago boys who struggle to become college basketball players on the road to going professional.,8.3
247,Heavenly Creatures,"['Biography', 'Crime', 'Drama']",['Peter Jackson'],"['Melanie Lynskey', 'Kate Winslet', 'Sarah Peirse']","Two teenage girls share a unique bond: their parents, concerned that the friendship is too intense, separate them, and the girls take revenge.",7.3
248,Houseguest,['Comedy'],['Randall Miller'],"['Sinbad', 'Phil Hartman', 'Kim Greist']","In hot water with the mob over an unpaid debt, a con man poses as a family friend in an affluent Pennsylvania suburb.",5.9
249,Immortal Beloved,"['Biography', 'Drama', 'Music']",['Bernard Rose'],"['Gary Oldman', 'Jeroen Krabbé', 'Isabella Rossellini']","A biopic exploring Beethoven's tumultuous life, focusing on his romantic pursuits. The film investigates the identity of the mysterious woman to whom the composer penned a passionate love letter, delving into his complex relations...",7.4
250,Heavyweights,"['Comedy', 'Drama', 'Family']",['Steven Brill'],"['Tom McGowan', 'Aaron Schwartz', 'Ben Stiller']","Plump kids are lured into joining a posh fat camp with the promise of quick weight loss and good times, only to find that it is a woodland hellhole run by a psycho ex-fitness instructor.",6.6
251,The Hunted,"['Action', 'Drama', 'Thriller']",['J.F. Lawton'],"['Christopher Lambert', 'John Lone', 'Joan Chen']","An American businessman visiting Nagoya, Japan, meets a woman in a hotel bar. Returning to her room, 3 ninjas kill her and wound him, but he sees the ninja boss' face. Now, he's the prime target of a dangerous ninja cult.",5.9
252,I.Q.,"['Comedy', 'Romance']",['Fred Schepisi'],"['Tim Robbins', 'Meg Ryan', 'Walter Matthau']","A mechanic romances the mathematician niece of physicist Albert Einstein, with help from him and his friends.",6.2
253,Interview with the Vampire,"['Drama', 'Fantasy', 'Horror']",['Neil Jordan'],"['Brad Pitt', 'Tom Cruise', 'Antonio Banderas']","A vampire tells his epic life story: love, betrayal, loneliness, and hunger.",7.5
254,Jefferson in Paris,"['Biography', 'Drama', 'History']",['James Ivory'],"['Nick Nolte', 'Greta Scacchi', 'Gwyneth Paltrow']",Widower Thomas Jefferson (3rd US president 1801-09) lives in Paris 1785-90 with his daughter. He has a pretty slave girl accompany his other daughter to France. He has an alleged affair with her resulting in children.,5.7
255,The Jerky Boys,"['Comedy', 'Crime']",['James Melkonian'],"['John G. Brennan', 'Kamal Ahmed', 'Alan Arkin']",A hilarious prank phone call pushes the buttons of an angry mob boss.,4.7
256,Junior,"['Comedy', 'Romance', 'Sci-Fi']",['Ivan Reitman'],"['Arnold Schwarzenegger', 'Danny DeVito', 'Emma Thompson']","As part of a fertility research project, a male scientist agrees to carry a pregnancy in his own body.",4.7
257,Just Cause,"['Action', 'Crime', 'Drama']",['Arne Glimcher'],"['Sean Connery', 'Laurence Fishburne', 'Kate Capshaw']",A Harvard professor is lured back into the courtroom after twenty-five years to take the case of a young black man condemned to death for the horrific murder of a child.,6.4
258,A Kid in King Arthur's Court,"['Adventure', 'Comedy', 'Family']",['Michael Gottlieb'],"['Thomas Ian Nicholas', 'Joss Ackland', 'Art Malik']",A Little League player is sent back into medieval times where he is given the task of saving Camelot.,4.7
259,Kiss of Death,"['Crime', 'Drama', 'Thriller']",['Barbet Schroeder'],"['David Caruso', 'Samuel L. Jackson', 'Nicolas Cage']",A reformed convict goes undercover with the help of an angry detective to ensnare a psychotic mobster.,5.9
260,Star Wars: Episode IV - A New Hope,"['Action', 'Adventure', 'Fantasy']",['George Lucas'],"['Mark Hamill', 'Harrison Ford', 'Carrie Fisher']","Luke Skywalker joins forces with a Jedi Knight, a cocky pilot, a Wookiee and two droids to save the galaxy from the Empire's world-destroying battle station, while also attempting to rescue Princess Leia from the mysterious Darth ...",8.6
261,Little Women,"['Drama', 'Family', 'Romance']",['Gillian Armstrong'],"['Susan Sarandon', 'Winona Ryder', 'Kirsten Dunst']","Jo struggles for independence and sometimes clashes with her beloved mother and sisters Meg, Amy and Beth. She also contends with their cranky Aunt March, their impulsive neighbor Laurie and kindly linguistics professor Friedrich ...",7.3
262,A Little Princess,"['Drama', 'Family', 'Fantasy']",['Alfonso Cuarón'],"['Liesel Matthews', 'Eleanor Bron', 'Liam Cunningham']","Sara is sent to a strict boarding school after her father enlists in WWI. When he is presumed dead, the headmistress, knowing she will not receive any more money, forces the girl to become a servant.",7.6
263,Ladybird Ladybird,['Drama'],['Ken Loach'],"['Crissy Rock', 'Vladimir Vega', 'Sandie Lavelle']","Maggie, an unmarried mother of four children by four different men who abused her, leaves her kids home alone one night. A fire injures them and child services takes custody. Maggie fails to regain custody of her children.",7.4
265,Like Water for Chocolate,"['Drama', 'Romance']",['Alfonso Arau'],"['Marco Leonardi', 'Lumi Cavazos', 'Regina Torné']","When tradition prevents her from marrying the man she loves, a young woman discovers she has a unique talent for cooking.",7.1
266,Legends of the Fall,"['Drama', 'Romance', 'War']",['Edward Zwick'],"['Brad Pitt', 'Anthony Hopkins', 'Aidan Quinn']","In the early 1900s, three brothers and their father living in the remote wilderness of Montana are affected by betrayal, history, love, nature, and war.",7.5
267,Major Payne,"['Adventure', 'Comedy', 'Family']",['Nick Castle'],"['Damon Wayans', 'Michael Ironside', 'Bam Bam Bigelow']","When a recently discharged Marine struggles to adjust to civilian life, his commanding officer brings him back to the military to train and lead a group of misfit JORTC cadets.",6.3
269,My Crazy Life,"['Crime', 'Drama']",['Allison Anders'],"['Angel Aviles', 'Seidy Lopez', 'Jacob Vargas']","Mousie and Sad Girl are childhood best friends in a contemporary Los Angeles poor Hispanic neighborhood. But when Sad Girl becomes pregnant by Mousie's boyfriend, a drug dealer named Ernesto, the two become bitter enemies. While t...",6.5
270,Love Affair,"['Comedy', 'Drama', 'Romance']",['Glenn Gordon Caron'],"['Warren Beatty', 'Annette Bening', 'Katharine Hepburn']","Two people meet on a flight to Sydney. Although both are engaged to others, they fall in love during their evacuation after a forced landing, and agree to meet in New York City three months later if the attraction lasts.",6.0
271,Losing Isaiah,['Drama'],['Stephen Gyllenhaal'],"['Jessica Lange', 'Halle Berry', 'David Strathairn']","The biological and adoptive mothers of a young boy are involved in a bitter, controversial custody battle.",6.4
272,The Madness of King George,"['Biography', 'Comedy', 'Drama']",['Nicholas Hytner'],"['Nigel Hawthorne', 'Helen Mirren', 'Rupert Graves']","When King George III goes mad, his Lieutenants try to adjust the rules to run the country without his participation.",7.2
273,Frankenstein,"['Drama', 'Horror', 'Romance']",['Kenneth Branagh'],"['Robert De Niro', 'Kenneth Branagh', 'Helena Bonham Carter']","When the brilliant but unorthodox scientist Dr. Victor Frankenstein rejects the artificial man that he has created, the Creature escapes and later swears revenge.",6.3
274,Man of the House,"['Comedy', 'Family']",['James Orr'],"['Chevy Chase', 'Farrah Fawcett', 'Jonathan Taylor Thomas']","A young boy refuses to accept his mother's new boyfriend despite his attempts to win his respect. Meanwhile, the disgruntled relative of a criminal he prosecuted seeks revenge.",5.3
275,Mixed Nuts,"['Comedy', 'Drama']",['Nora Ephron'],"['Steve Martin', 'Madeline Kahn', 'Robert Klein']",The events focus around a crisis hotline business on one crazy night during the Christmas holidays.,5.4
276,Milk Money,"['Comedy', 'Romance']",['Richard Benjamin'],"['Melanie Griffith', 'Ed Harris', 'Michael Patrick Carter']",A group of young boys befriend a prostitute named V.,5.6
277,Miracle on 34th Street,"['Drama', 'Family', 'Fantasy']",['Les Mayfield'],"['Richard Attenborough', 'Elizabeth Perkins', 'Dylan McDermott']",A lawyer and a little girl must prove that a man claiming to be Santa Claus is the real thing.,6.6
278,Miami Rhapsody,"['Comedy', 'Romance']",['David Frankel'],"['Sarah Jessica Parker', 'Mia Farrow', 'Antonio Banderas']","Gwyn begins doubting her ""yes"" to Matt's wedding proposal, when she hears about her parents' and brother's adultery.",5.4
279,My Family,['Drama'],['Gregory Nava'],"['Jimmy Smits', 'Esai Morales', 'Edward James Olmos']",A man makes his way from Mexico to Los Angeles in the 1920s and gets married and raises a big family there. The movie follows the children until they get married and start their families in the 1960s.,7.3
280,Murder in the First,"['Drama', 'Thriller']",['Marc Rocco'],"['Christian Slater', 'Kevin Bacon', 'Gary Oldman']",An eager and idealistic young attorney defends an Alcatraz prisoner accused of murdering a fellow inmate. The extenuating circumstances: his client had just spent over three years in solitary confinement.,7.3
281,Nobody's Fool,"['Comedy', 'Drama']",['Robert Benton'],"['Paul Newman', 'Bruce Willis', 'Jessica Tandy']",A stubborn man past his prime reflects on his life of strict independence and seeks more from himself.,7.3
282,Nell,['Drama'],['Michael Apted'],"['Jodie Foster', 'Liam Neeson', 'Natasha Richardson']","In a remote woodland cabin, a small-town doctor discovers Nell - a beautiful young hermit-woman with many secrets.",6.5
283,New Jersey Drive,"['Crime', 'Drama']",['Nick Gomez'],"['Shar-Ron Corley', 'Gabriel Casseus', 'Saul Stein']","Jason and Midget are two young, black teenagers living in Newark,New Jersey, the unofficial car theft capital of the world. Their favourite pastime is that of everybody in their neighbourhood: stealing cars and joyriding. The trou...",6.6
284,New York Cop,"['Action', 'Crime', 'Drama']",['Tôru Murakawa'],"['Tôru Nakamura', 'Chad McQueen', 'Mira Sorvino']","A Japanese detective, illegally residing in the U.S., finds himself blackmailed by the NYPD internal force and sent undercover to break a ring of Asian gun dealers.",4.3
285,Beyond Bedlam,"['Comedy', 'Horror']",['Vadim Jean'],"['Craig Fairbrass', 'Elizabeth Hurley', 'Keith Allen']","Dr. Stephanie Lyell works for Neurological Research, and is testing a seemingly safe personality-altering drug on Marc Gilmour a notorious Serial Killer. But when a pair of bizarre suicides occur at Dr. Lyell's apartment complex, ...",3.2
287,Nina Takes a Lover,"['Comedy', 'Drama', 'Romance']",['Alan Jacobs'],"['Laura San Giacomo', 'Paul Rhys', ""Michael O'Keefe""]",A lonely young woman decides to kindle her passions in a fling with a married photographer after feeling challenged by her own best friend's affair.,5.4
288,Natural Born Killers,"['Crime', 'Romance']",['Oliver Stone'],"['Woody Harrelson', 'Juliette Lewis', 'O-Lan Jones']",Two victims of traumatized childhoods become lovers and psychopathic serial murderers irresponsibly glorified by the mass media.,7.2
289,Only You,"['Comedy', 'Romance']",['Norman Jewison'],"['Marisa Tomei', 'Robert Downey Jr.', 'Bonnie Hunt']","As a teen, Faith was told that her destiny is a man named Damon Bradley. Years later, when she's about to marry someone else, a Damon Bradley calls to wish them well, and Faith blows off her wedding to follow Damon to Italy.",6.5
290,Once Were Warriors,"['Crime', 'Drama']",['Lee Tamahori'],"['Rena Owen', 'Temuera Morrison', 'Mamaengaroa Kerr-Bell']",A family descended from Maori warriors is bedeviled by a violent father and the societal problems of being treated as outcasts.,7.9
291,Poison Ivy II,"['Drama', 'Thriller']",['Anne Goursaud'],"['Alyssa Milano', 'Johnathon Schaech', 'Xander Berkeley']","First time out of Michigan, Lily starts art school in LA and shares a house with other young artistic people. Both her teacher and a roomie/classmate show interest in her.",4.4
292,Outbreak,"['Action', 'Drama', 'Thriller']",['Wolfgang Petersen'],"['Dustin Hoffman', 'Rene Russo', 'Morgan Freeman']",A team of Army doctors struggle to find a cure for the deadly Motaba virus that was transported from Africa to North America by a white-headed Capuchin monkey and is now spreading quickly throughout a small California town.,6.6
293,Léon: The Professional,"['Action', 'Crime', 'Drama']",['Luc Besson'],"['Jean Reno', 'Gary Oldman', 'Natalie Portman']","12-year-old Mathilda is reluctantly taken in by Léon, a professional assassin, after her family is murdered. An unusual relationship forms as she becomes his protégée and learns the assassin's trade.",8.5
294,The Perez Family,"['Comedy', 'Romance', 'Drama']",['Mira Nair'],"['Marisa Tomei', 'Anjelica Huston', 'Alfred Molina']","In 1980, USA opens to Cuban refugees. Once in Miami, Dorita tries to create a Perez ""family"" of 3 to get a sponsor. She wants Juan to be her ""husband"" - plus a ""son"" or ""dad"".",6.0
295,A Pyromaniac's Love Story,"['Comedy', 'Romance']",['Joshua Brand'],"['William Baldwin', 'John Leguizamo', 'Sadie Frost']","A pastry boy and the son of a hair-piece mogul become involved in an arson scandal. Sergio (John Leguizamo) is offered a bribe in exchange for taking the blame for the fire that destroyed his workplace. Garet (William Baldwin), th...",5.3
296,Pulp Fiction,"['Crime', 'Drama']",['Quentin Tarantino'],"['John Travolta', 'Uma Thurman', 'Samuel L. Jackson']","The lives of two mob hitmen, a boxer, a gangster and his wife, and a pair of diner bandits intertwine in four tales of violence and redemption.",8.9
298,Pushing Hands,"['Comedy', 'Drama']",['Ang Lee'],"['Sihung Lung', 'Lai Wang', 'Bozhao Wang']","All the while, Master Chu tries to find his place in the foreign American world.",7.2
299,Priest,"['Drama', 'Romance']",['Antonia Bird'],"['Linus Roache', 'Tom Wilkinson', 'Robert Carlyle']","A homosexual Catholic priest finds out during confessional that a young girl is being sexually abused by her father, and has to decide how to deal with both that secret and his own.",7.1
300,Quiz Show,"['Biography', 'Drama', 'History']",['Robert Redford'],"['Ralph Fiennes', 'John Turturro', 'Rob Morrow']","A young lawyer, Richard Goodwin, investigates a potentially fixed game show. Charles Van Doren, a big time show winner, is under Goodwin's investigation.",7.5
301,Picture Bride,"['Drama', 'Romance']",['Kayo Hatta'],"['Yûki Kudô', 'Akira Takayama', 'Cary-Hiroyuki Tagawa']",Riyo marries a man more than twice her age. She is devastated and labors in the sugar cane field. At the end she is able to love her husband.,6.6
302,Queen Margot,"['Biography', 'Drama', 'History']",['Patrice Chéreau'],"['Isabelle Adjani', 'Daniel Auteuil', 'Jean-Hugues Anglade']","Young Queen Margot finds herself trapped in an arranged marriage amidst a religious war between Catholics and Protestants. She hopes to escape with a new lover, but finds herself imprisoned by her powerful and ruthless family.",7.4
303,The Quick and the Dead,"['Action', 'Drama', 'Romance']",['Sam Raimi'],"['Sharon Stone', 'Gene Hackman', 'Russell Crowe']","A female gunfighter returns to a frontier town where a dueling tournament is being held, which she enters in an effort to avenge her father's death.",6.5
304,Roommates,"['Comedy', 'Drama']",['Peter Yates'],"['Peter Falk', 'D.B. Sweeney', 'Julianne Moore']",An elderly yet young-at-heart man moves in with his grandson and both their lives turn upside-down.,6.4
305,Ready to Wear,"['Comedy', 'Drama']",['Robert Altman'],"['Sophia Loren', 'Julia Roberts', 'Marcello Mastroianni']",A chronicle of the interconnected lives of a group of people in the lead up to Paris Fashion Week.,5.2
306,Three Colors: Red,"['Drama', 'Mystery', 'Romance']",['Krzysztof Kieslowski'],"['Irène Jacob', 'Jean-Louis Trintignant', 'Frédérique Feder']",A model discovers a retired judge is keen on invading people's privacy.,8.1
307,Three Colors: Blue,"['Drama', 'Music', 'Mystery']",['Krzysztof Kieslowski'],"['Juliette Binoche', 'Zbigniew Zamachowski', 'Julie Delpy']",A woman struggles to find a way to live her life after the death of her husband and child.,7.8
308,Three Colors: White,"['Comedy', 'Drama', 'Romance']",['Krzysztof Kieslowski'],"['Zbigniew Zamachowski', 'Julie Delpy', 'Janusz Gajos']","After his wife divorces him, a Polish immigrant plots to get even with her.",7.6
310,Rent-a-Kid,"['Drama', 'Family', 'Comedy']",['Fred Gerber'],"['Leslie Nielsen', 'Christopher Lloyd', 'Matt McCoy']","Harry Haber, the owner of a rent office, has an original idea: to rent babies from a nearby orphanage to the local families. He rents the three Ward children to his first customers.",5.4
311,Relative Fear,"['Drama', 'Horror', 'Thriller']",['George Mihalka'],"['Darlanne Fluegel', 'Martin Neufeld', 'James Brolin']",Just why are people surrounding Adam Pratman dropping down dead? Is this five year old really a murderous sociopath?,5.5
312,Stuart Saves His Family,"['Comedy', 'Drama']",['Harold Ramis'],"['Al Franken', 'Laura San Giacomo', ""Vincent D'Onofrio""]",A self-help advocate struggles to put his dysfunctional family in its place.,5.3
313,The Swan Princess,"['Animation', 'Adventure', 'Comedy']",['Richard Rich'],"['Jack Palance', 'Howard McGillin', 'Michelle Nicastro']",A power-hungry sorcerer curses a princess to live as a swan by day in this tale of everlasting love.,6.4
314,The Secret of Roan Inish,"['Drama', 'Family', 'Fantasy']",['John Sayles'],"['Jeni Courtney', 'Eileen Colgan', 'Mick Lally']",Young Fiona lives with her grandparents in a small fishing village where she takes an active role to unravel the mysterious secrets.,7.4
315,The Specialist,"['Action', 'Drama', 'Thriller']",['Luis Llosa'],"['Sylvester Stallone', 'Sharon Stone', 'James Woods']",A woman entices a bomb expert she's involved with into destroying the mafia that killed her family.,5.6
316,Stargate,"['Action', 'Adventure', 'Sci-Fi']",['Roland Emmerich'],"['Kurt Russell', 'James Spader', 'Jaye Davidson']","An interstellar teleportation device, found in Egypt, leads to a planet with humans resembling ancient Egyptians who worship the god Ra.",7.0
317,The Santa Clause,"['Comedy', 'Drama', 'Family']",['John Pasquin'],"['Tim Allen', 'Judge Reinhold', 'Wendy Crewson']","When a man inadvertently makes Santa fall off his roof on Christmas Eve, he finds himself magically recruited to take his place.",6.6
