movieId,title,genres,directors,actors,overview,voteAverage
318,The Shawshank Redemption,['Drama'],['Frank Darabont'],"['Tim Robbins', 'Morgan Freeman', 'Bob Gunton']","A banker convicted of uxoricide forms a friendship over a quarter century with a hardened convict, while maintaining his innocence and trying to remain hopeful through simple compassion.",9.3
319,Shallow Grave,"['Crime', 'Drama', 'Thriller']",['Danny Boyle'],"['Kerry Fox', 'Christopher Eccleston', 'Ewan McGregor']",Three friends discover their new flatmate dead but loaded with cash.,7.2
320,Suture,"['Drama', 'Thriller']","['Scott McGehee', 'David Siegel']","['Dennis Haysbert', 'Mel Harris', 'Sab Shimono']","After his brother tries to kill him, a man survives only to find himself in another man's body.",6.5
321,Strawberry & Chocolate,"['Comedy', 'Drama', 'Romance']","['Tomás Gutiérrez Alea', 'Juan Carlos Tabío']","['Jorge Perugorría', 'Vladimir Cruz', 'Mirta Ibarra']","Story of two men who are opposites: one gay, the other straight; one a fierce communist, the other a fierce individualist; one suspicious, the other accepting; and how they come to love each other.",7.4
322,Swimming with Sharks,"['Comedy', 'Crime']",['George Huang'],"['Kevin Spacey', 'Frank Whaley', 'Michelle Forbes']","A young, naive Hollywood studio assistant finally turns the tables on his incredibly abusive producer boss.",7.0
324,The Sum of Us,"['Comedy', 'Drama']","['Geoff Burton', 'Kevin Dowling']","['Jack Thompson', 'Russell Crowe', 'John Polson']","A widowed father has to deal with two complex issues: while he is searching for ""Miss Right,"" his son, who is in his 20s and gay, is searching for ""Mr. Right.""",7.3
325,National Lampoon's Senior Trip,"['Adventure', 'Comedy']",['Kelly Makin'],"['Matt Frewer', 'Valerie Mahaffey', 'Lawrence Dane']","To embarrass his rival, a scheming senator uses nitwit Ohio teens who are invited to a Washington gathering on educational failure.",5.6
326,To Live,"['Drama', 'War']",['Yimou Zhang'],"['You Ge', 'Gong Li', 'Ben Niu']","After Fugui and Jiazhen lose their personal fortunes, they raise a family and survive difficult cultural changes during 1940s to 1970s China.",8.3
327,Tank Girl,"['Action', 'Comedy', 'Sci-Fi']",['Rachel Talalay'],"['Lori Petty', 'Ice-T', 'Naomi Watts']","A girl is among the few survivors of a dystopian Earth. Riding a war tank, she fights against the tyranny of a mega-corporation that dominates the remaining potable water supply of the planet.",5.4
328,Tales from the Crypt: Demon Knight,"['Action', 'Fantasy', 'Horror']",['Ernest R. Dickerson'],"['Billy Zane', 'William Sadler', 'Jada Pinkett Smith']",High-level demons collect low-level demons as warriors in attempt to obtain a key containing the blood of Christ. The key is guarded by immortal warriors called Demon Knights.,6.7
329,Star Trek: Generations,"['Action', 'Adventure', 'Mystery']",['David Carson'],"['Patrick Stewart', 'William Shatner', 'Malcolm McDowell']","With the help of long presumed dead Captain Kirk, Captain Picard must stop a deranged scientist willing to murder on a planetary scale in order to enter a space matrix.",6.6
330,Tales from the Hood,"['Crime', 'Drama', 'Horror']",['Rusty Cundieff'],"['Clarence Williams III', 'Corbin Bernsen', 'Joe Torry']",A funeral director tells four strange tales of horror with an African American focus to three drug dealers he traps in his place of business.,6.5
331,Tom & Viv,"['Biography', 'Drama', 'Romance']",['Brian Gilbert'],"['Willem Dafoe', 'Miranda Richardson', 'Rosemary Harris']","In 1915, Tom and Viv elope, but her gynecological and emotional problems disrupt their honeymoon. Her father is angry because Tom's poetry doesn't bring in enough to live, but her mother is happy Viv has found a tender and discree...",6.2
332,Village of the Damned,"['Horror', 'Sci-Fi', 'Thriller']",['John Carpenter'],"['Christopher Reeve', 'Kirstie Alley', 'Linda Kozlowski']",A small town's women give birth to unfriendly alien children posing as humans.,5.6
333,Tommy Boy,"['Adventure', 'Comedy']",['Peter Segal'],"['Chris Farley', 'David Spade', 'Brian Dennehy']","After his auto-parts tycoon father dies, the overweight, underachieving son teams up with a snide accountant to try and save the family business.",7.1
334,Vanya on 42nd Street,"['Comedy', 'Drama', 'Romance']",['Louis Malle'],"['Wallace Shawn', 'Phoebe Brand', 'George Gaynes']","New York actors rehearse Chekhov's ""Uncle Vanya"" in a dilapidated theatre.",7.3
335,The Underneath,"['Crime', 'Thriller']",['Steven Soderbergh'],"['Peter Gallagher', 'Elisabeth Shue', 'Alison Elliott']",A recovering gambling addict attempts to reconcile with his family and friends but finds trouble and temptation when caught between feelings for his ex-wife and her dangerous hoodlum boyfriend.,6.1
336,The Walking Dead,"['Action', 'Drama', 'War']",['Preston A. Whitmore II'],"['Allen Payne', 'Eddie Griffin', 'Joe Morton']","1972 Vietnam, a small group of United States Marines relive flashbacks of their contrite lives prior to serving in the military while being left to survive behind enemy lines.",4.9
337,What's Eating Gilbert Grape,['Drama'],['Lasse Hallström'],"['Johnny Depp', 'Leonardo DiCaprio', 'Juliette Lewis']",A young man in a small Midwestern town struggles to care for his mentally-disabled younger brother and morbidly obese mother while attempting to pursue his own happiness.,7.7
338,Virtuosity,"['Action', 'Crime', 'Sci-Fi']",['Brett Leonard'],"['Denzel Washington', 'Russell Crowe', 'Kelly Lynch']","When a virtual reality simulation created using the personalities of multiple serial killers manages to escape into the real world, an ex-cop is tasked with stopping its reign of terror.",5.5
339,While You Were Sleeping,"['Comedy', 'Drama', 'Romance']",['Jon Turteltaub'],"['Sandra Bullock', 'Bill Pullman', 'Peter Gallagher']",A hopelessly romantic Chicago Transit Authority ticket booth operator is mistaken for the fiancée of a comatose patient.,6.8
340,The War,"['Drama', 'History', 'War']",['Jon Avnet'],"['Elijah Wood', 'Kevin Costner', 'Mare Winningham']",A Vietnam veteran helps his kids battle over a tree house while recovering from his traumatic war experience.,6.8
341,Double Happiness,"['Drama', 'Romance']",['Mina Shum'],"['Sandra Oh', 'Stephen Chang', 'Claudette Carracedo']","East clashes with West and generations collide as a young Chinese woman struggles to appease her old-fashioned father, and at the same time pursue her modern dreams.",7.1
342,Muriel's Wedding,"['Comedy', 'Drama']",['P.J. Hogan'],"['Toni Collette', 'Rachel Griffiths', 'Bill Hunter']","A young social outcast in Australia steals money from her parents to finance a vacation where she hopes to find happiness, and perhaps love.",7.2
343,The Baby-Sitters Club,"['Comedy', 'Drama', 'Family']",['Melanie Mayron'],"['Schuyler Fisk', 'Bre Blair', 'Rachael Leigh Cook']",Seven junior-high-school girls organize a daycare camp for children while at the same time experiencing classic adolescent growing pains.,5.7
344,Ace Ventura: Pet Detective,['Comedy'],['Tom Shadyac'],"['Jim Carrey', 'Courteney Cox', 'Sean Young']",A goofy detective specializing in animals goes in search of the missing mascot of the Miami Dolphins.,6.9
345,"The Adventures of Priscilla, Queen of the Desert","['Comedy', 'Music']",['Stephan Elliott'],"['Hugo Weaving', 'Guy Pearce', 'Terence Stamp']",Two drag performers and a transgender woman travel across the desert to perform their unique style of cabaret.,7.5
346,Backbeat,"['Biography', 'Drama', 'Music']",['Iain Softley'],"['Stephen Dorff', 'Sheryl Lee', 'Ian Hart']","A dramatization of the Hamburg, Germany phase of The Beatles' early history.",6.6
347,Bitter Moon,"['Drama', 'Romance', 'Thriller']",['Roman Polanski'],"['Hugh Grant', 'Kristin Scott Thomas', 'Emmanuelle Seigner']","After hearing stories of her, a passenger on a cruise ship develops an irresistible infatuation with an eccentric paraplegic's wife.",7.2
348,Bullets Over Broadway,"['Comedy', 'Crime']",['Woody Allen'],"['John Cusack', 'Dianne Wiest', 'Jennifer Tilly']","In New York in 1928, a struggling playwright is forced to cast a mobster's talentless girlfriend in his latest drama in order to get it produced.",7.4
349,Clear and Present Danger,"['Action', 'Crime', 'Drama']",['Phillip Noyce'],"['Harrison Ford', 'Willem Dafoe', 'Anne Archer']",CIA Analyst Jack Ryan is drawn into an illegal war fought by the US government against a Colombian drug cartel.,6.9
350,The Client,"['Crime', 'Drama', 'Mystery']",['Joel Schumacher'],"['Susan Sarandon', 'Tommy Lee Jones', 'Brad Renfro']",A young boy who witnessed the suicide of a mafia lawyer hires an attorney to protect him when the District Attorney tries to use him to take down a mob family.,6.7
351,"Corrina, Corrina","['Comedy', 'Drama', 'Romance']",['Jessie Nelson'],"['Ray Liotta', 'Whoopi Goldberg', 'Tina Majorino']","In 1959, a widower hires a warm-hearted housekeeper/nanny to care for his seven-year-old daughter.",6.6
352,Crooklyn,"['Comedy', 'Drama']",['Spike Lee'],"['Alfre Woodard', 'Delroy Lindo', 'David Patrick Kelly']","Spike Lee's vibrant semi-autobiographical portrait of a school teacher, her stubborn jazz musician husband and their five kids living in Brooklyn in 1973.",7.0
353,The Crow,"['Action', 'Crime', 'Drama']",['Alex Proyas'],"['Brandon Lee', 'Michael Wincott', 'Rochelle Davis']","The night before his wedding, musician Eric Draven and his fiancée are brutally murdered by members of a violent gang. On the anniversary of their death, Eric rises from the grave and assumes the mantle of the Crow, a supernatural...",7.5
354,Cobb,"['Biography', 'Drama', 'Sport']",['Ron Shelton'],"['Tommy Lee Jones', 'Robert Wuhl', 'Lolita Davidovich']",A reporter hired to write the 'official' biography of Ty Cobb discovers just how dark the baseball legend's real story is.,6.4
355,The Flintstones,"['Comedy', 'Family', 'Fantasy']",['Brian Levant'],"['John Goodman', 'Rick Moranis', ""Rosie O'Donnell""]","In a parallel modern-day Stone Age world, a working-class family, the Flintstones, are set up for an executive job. But they learn that money can't buy happiness.",5.0
356,Forrest Gump,"['Drama', 'Romance']",['Robert Zemeckis'],"['Tom Hanks', 'Robin Wright', 'Gary Sinise']","The history of the United States from the 1950s to the '70s unfolds from the perspective of an Alabama man with an IQ of 75, who yearns to be reunited with his childhood sweetheart.",8.8
357,Four Weddings and a Funeral,"['Comedy', 'Drama', 'Romance']",['Mike Newell'],"['Hugh Grant', 'Andie MacDowell', 'James Fleet']","Over the course of five social occasions, a committed bachelor must consider the notion that he may have discovered love.",7.1
358,Higher Learning,"['Crime', 'Drama', 'Thriller']",['John Singleton'],"['Omar Epps', 'Kristy Swanson', 'Michael Rapaport']","People from all different walks of life, encounter racial tension, rape, responsibility, and the meaning of an education on a university campus.",6.5
359,I Like It Like That,"['Comedy', 'Drama', 'Romance']",['Darnell Martin'],"['Luna Lauren Velez', 'Jon Seda', 'Tomas Melly']",Money issues and misunderstandings divide a couple who struggle to raise their children in the Bronx.,6.7
360,I Love Trouble,"['Action', 'Comedy', 'Romance']",['Charles Shyer'],"['Nick Nolte', 'Julia Roberts', 'Saul Rubinek']",Peter Brackett and Sabrina Peterson are two competing Chicago newspaper reporters who join forces to unravel the mystery behind a train derailment.,5.3
361,It Could Happen to You,"['Comedy', 'Drama', 'Romance']",['Andrew Bergman'],"['Nicolas Cage', 'Bridget Fonda', 'Rosie Perez']",A police officer promises to share his lottery ticket with a waitress in lieu of a tip.,6.4
362,The Jungle Book,"['Adventure', 'Family', 'Fantasy']",['Stephen Sommers'],"['Jason Scott Lee', 'Cary Elwes', 'Lena Headey']","Rudyard Kipling's classic tale of Mowgli, the orphaned jungle boy raised by wild animals, and how he becomes king of the jungle.",6.1
363,"The Wonderful, Horrible Life of Leni Riefenstahl","['Documentary', 'Biography', 'History']",['Ray Müller'],"['Leni Riefenstahl', 'Marlene Dietrich', 'Arnold Fanck']","A documentary about the life and work of Leni Riefenstahl, a German film director most notorious for making the most effective propaganda films for the Nazis.",8.0
364,The Lion King,"['Animation', 'Adventure', 'Drama']","['Roger Allers', 'Rob Minkoff']","['Matthew Broderick', 'Jeremy Irons', 'James Earl Jones']","Lion prince Simba and his father are targeted by his bitter uncle, who wants to ascend the throne himself.",8.5
365,Little Buddha,['Drama'],['Bernardo Bertolucci'],"['Keanu Reeves', 'Bridget Fonda', 'Ruocheng Ying']","After the death of Lama Dorje, Tibetan Buddhist monks find three children - one American and two Nepalese - who may be the rebirth of their great teacher.",6.1
366,New Nightmare,"['Fantasy', 'Horror', 'Mystery']",['Wes Craven'],"['Heather Langenkamp', 'Robert Englund', 'Jf Davis']",A demonic force has chosen Freddy Krueger as its portal to the real world. Can Heather Langenkamp play the part of Nancy one last time and trap the evil trying to enter our world?,6.4
367,The Mask,"['Comedy', 'Crime', 'Fantasy']",['Chuck Russell'],"['Jim Carrey', 'Cameron Diaz', 'Peter Riegert']",Bank clerk Stanley Ipkiss is transformed into a manic superhero when he wears a mysterious mask.,7.0
368,Maverick,"['Action', 'Adventure', 'Comedy']",['Richard Donner'],"['Mel Gibson', 'Jodie Foster', 'James Garner']","Bret Maverick, needing money for a poker tournament, faces various comic mishaps and challenges, including a charming woman thief.",7.0
369,Mrs. Parker and the Vicious Circle,"['Biography', 'Drama']",['Alan Rudolph'],"['Jennifer Jason Leigh', 'Campbell Scott', 'Matthew Broderick']","Dorothy Parker remembers the heyday of the Algonquin Round Table, a circle of friends whose barbed wit, like hers, was fueled by alcohol and flirted with despair.",6.4
370,Naked Gun 33 1/3: The Final Insult,"['Comedy', 'Crime']",['Peter Segal'],"['Leslie Nielsen', 'Priscilla Presley', 'George Kennedy']",Frank Drebin comes out of retirement to help Police Squad infiltrate a gang of terrorists planning to detonate a bomb at the Academy Awards.,6.5
371,The Paper,"['Comedy', 'Drama']",['Ron Howard'],"['Michael Keaton', 'Glenn Close', 'Robert Duvall']","New York City tabloid editor Henry's faced with tough decisions while he faces several serious life challenges, and a tempting job offer.",6.7
372,Reality Bites,"['Comedy', 'Drama', 'Romance']",['Ben Stiller'],"['Winona Ryder', 'Ethan Hawke', 'Janeane Garofalo']","A documentary filmmaker and her fellow Generation X graduates face life after college, looking for work and love in Houston.",6.6
373,Red Rock West,"['Crime', 'Drama', 'Thriller']",['John Dahl'],"['Nicolas Cage', 'Dennis Hopper', 'Lara Flynn Boyle']","Upon arriving to a small town, a drifter is mistaken for a hitman, but when the real hitman arrives, complications ensue.",7.0
374,Richie Rich,"['Comedy', 'Family']",['Donald Petrie'],"['Macaulay Culkin', 'Edward Herrmann', 'John Larroquette']","Richie Rich is the richest kid in the world. The one thing Richie doesn't have is friends. When his parents suddenly go missing, Richie hooks up with a group of kids who just might fill the void in his life, while helping save his...",5.4
376,The River Wild,"['Adventure', 'Crime', 'Thriller']",['Curtis Hanson'],"['Meryl Streep', 'Kevin Bacon', 'David Strathairn']",Rafting expert Gail takes on a pair of armed killers while navigating a spectacularly violent river.,6.5
377,Speed,"['Action', 'Adventure', 'Thriller']",['Jan de Bont'],"['Keanu Reeves', 'Dennis Hopper', 'Sandra Bullock']",A young police officer must prevent a bomb exploding aboard a city bus by keeping its speed above 50 mph.,7.3
378,Speechless,"['Comedy', 'Romance']",['Ron Underwood'],"['Michael Keaton', 'Geena Davis', 'Christopher Reeve']",Two political speechwriters fall in love before they find out they are working for candidates on opposite sides.,5.8
379,Timecop,"['Action', 'Crime', 'Sci-Fi']",['Peter Hyams'],"['Jean-Claude Van Damme', 'Mia Sara', 'Ron Silver']","Max Walker, an officer for a security agency that regulates time travel, must fend for his life against a shady politician who's intent on changing the past to control the future.",5.9
380,True Lies,"['Action', 'Comedy', 'Thriller']",['James Cameron'],"['Arnold Schwarzenegger', 'Jamie Lee Curtis', 'Tom Arnold']","A fearless, globe-trotting, terrorist-battling secret agent has his life turned upside down when he discovers his wife might be having an affair with a used-car salesman while terrorists smuggle nuclear war heads into the United S...",7.3
381,When a Man Loves a Woman,"['Drama', 'Romance']",['Luis Mandoki'],"['Meg Ryan', 'Andy Garcia', 'Ellen Burstyn']",The seemingly perfect relationship between a man and his wife is tested as a result of her alcoholism.,6.6
382,Wolf,"['Drama', 'Horror', 'Romance']",['Mike Nichols'],"['Jack Nicholson', 'Michelle Pfeiffer', 'James Spader']",Publisher Will Randall becomes a demon wolf and has to fight to keep his job.,6.3
383,Wyatt Earp,"['Adventure', 'Biography', 'Drama']",['Lawrence Kasdan'],"['Kevin Costner', 'Dennis Quaid', 'Gene Hackman']","From Wichita to Dodge City, to the O.K. Corral in Tombstone, a man becomes a myth in this thrilling journey of romance, adventure, and desperate heroic action.",6.7
384,Bad Company,"['Crime', 'Drama', 'Thriller']",['Damian Harris'],"['Ellen Barkin', 'Laurence Fishburne', 'Frank Langella']","CIA agent Crowe is forced to join Grimes Organization for blackmail operations. He works with Wells targeting a judge, while Stapp uncovers his CIA past.",5.4
385,A Man of No Importance,"['Comedy', 'Drama']",['Suri Krishnamma'],"['Albert Finney', 'Brenda Fricker', 'Michael Gambon']","A friendly, poetry quoting bus conductor in 1963 Dublin wants to stage Oscar Wilde's play, Salome, with passengers on his bus.",6.7
386,S.F.W.,"['Comedy', 'Drama']",['Jefery Levy'],"['Stephen Dorff', 'Reese Witherspoon', 'Jake Busey']",An alienated and misanthropic teenager gains sudden and unwanted celebrity status after he's taken hostage by terrorists where his indifference to their threats to kill him makes news headlines.,5.7
387,A Low Down Dirty Shame,"['Action', 'Comedy', 'Crime']",['Keenen Ivory Wayans'],"['Keenen Ivory Wayans', 'Charles S. Dutton', 'Jada Pinkett Smith']","An ex-cop, now a private detective, takes on the search for the millions stolen by a drug lord.",5.9
388,"Boys Life: Three Stories of Love, Lust, and Liberation",['Drama'],"['Robert Lee King', ""Raoul O'Connell"", 'Brian Sloan']","['James Andrews', 'Mary Beth Aylesworth', 'Mike Barbour']","Each of the three short films in this collection presents a young gay man at the threshold of adulthood. In ""Pool Days,"" Justin is a 17-year old Bethesda lad, hired as the evening life guard at a fitness center. In the course of t...",7.3
389,Colonel Chabert,"['Drama', 'History', 'Romance']",['Yves Angelo'],"['Gérard Depardieu', 'Fanny Ardant', 'Fabrice Luchini']","Upon returning home after a ten year absence, a Colonel in Napoleon's army discovers that his wife has remarried and has used his pension to amass great wealth.",6.9
390,"Faster, Pussycat! Kill! Kill!","['Action', 'Comedy']",['Russ Meyer'],"['Tura Satana', 'Haji', 'Lori Williams']","Three thrill-seeking go-go dancers kidnap a young girl and attempt to swindle an old rancher and his two sons out of their small fortune, but their scheme does not play out as they intended.",6.6
391,Jason's Lyric,"['Crime', 'Drama', 'Romance']",['Doug McHenry'],"['Allen Payne', 'Jada Pinkett Smith', 'Bokeem Woodbine']","Two brothers, survivors of family tragedy, take different life paths: one falls for a high-spirited waitress and dreams of success, the other follows a life of petty crime. Their lives reconnect in shattering fashion.",6.6
393,Street Fighter,"['Action', 'Adventure', 'Comedy']",['Steven E. de Souza'],"['Jean-Claude Van Damme', 'Raul Julia', 'Ming-Na Wen']","In the midst of a civil war in South East Asia, a general intensifies the climate of violence by kidnapping 63 UN delegates. To free the hostages, a colonel leads a group of fighters, who will have to use all their skills to be su...",4.1
405,Highlander: The Final Dimension,"['Action', 'Fantasy', 'Romance']",['Andrew Morahan'],"['Christopher Lambert', 'Mario Van Peebles', 'Deborah Kara Unger']","Deceived that he had won the Prize, Connor MacLeod awakens from a peaceful life when an entombed immortal magician comes seeking the Highlander.",4.5
406,Federal Hill,"['Crime', 'Drama']",['Michael Corrente'],"['Nicholas Turturro', 'Anthony DeSando', 'Libby Langdon']","On the mean streets of Providence, five friends struggle for a future in the mob-infested neighborhood known as Federal hill. Petty burglar Ralph and his drug-dealing friend Nicky are inseparable until Nicky meets a beautiful….",6.3
407,In the Mouth of Madness,"['Drama', 'Fantasy', 'Horror']",['John Carpenter'],"['Sam Neill', 'Jürgen Prochnow', 'Julie Carmen']",An insurance investigator begins discovering that the impact a horror writer's books have on his fans is more than inspirational.,7.1
408,8 Seconds,"['Biography', 'Drama', 'Sport']",['John G. Avildsen'],"['Luke Perry', 'Stephen Baldwin', 'James Rebhorn']","This movie chronicles the life of Lane Frost, 1987 PRCA Bull Riding World Champion, his marriage and his friendships with Tuff Hedeman (three-time World Champion) and Cody Lambert.",6.6
409,Above the Rim,"['Crime', 'Drama', 'Sport']",['Jeff Pollack'],"['Duane Martin', 'Tupac Shakur', 'Leon']","Story of a promising high school basketball star and his relationships with two brothers, one a drug dealer and the other a former basketball star fallen on hard times and now employed as a security guard.",6.6
410,Addams Family Values,"['Comedy', 'Fantasy']",['Barry Sonnenfeld'],"['Anjelica Huston', 'Raul Julia', 'Christopher Lloyd']","The Addams Family try to rescue their beloved Uncle Fester from his gold-digging new love, a black widow named Debbie.",6.8
412,The Age of Innocence,"['Drama', 'Romance']",['Martin Scorsese'],"['Daniel Day-Lewis', 'Michelle Pfeiffer', 'Winona Ryder']","A tale of nineteenth-century New York high society in which a young lawyer falls in love with a woman separated from her husband, while he is engaged to the woman's cousin.",7.2
413,Airheads,"['Comedy', 'Crime', 'Music']",['Michael Lehmann'],"['Brendan Fraser', 'Steve Buscemi', 'Adam Sandler']",Three band members hoping for a big break head to a radio station to play their demo tape and wind up holding everyone hostage with plastic guns when the head D.J. refuses to play them.,6.2
414,The Air Up There,"['Comedy', 'Family', 'Sport']",['Paul Michael Glaser'],"['Kevin Bacon', 'Charles Gitonga Maina', 'Yolanda Vazquez']",A basketball coach travels to Africa to recruit a new star.,5.6
415,Another Stakeout,"['Comedy', 'Crime']",['John Badham'],"['Richard Dreyfuss', 'Emilio Estevez', ""Rosie O'Donnell""]",Immature detectives Chris Lecce and Bill Reimers are joined by pesky assistant district attorney Gina Garrett in staking out a lakeside home where Mafia trial witness Luella Delano is believed to be heading.,5.6
416,Bad Girls,"['Action', 'Adventure', 'Drama']",['Jonathan Kaplan'],"['Madeleine Stowe', 'Mary Stuart Masterson', 'Andie MacDowell']",Four prostitutes join together to travel the Old West.,5.2
417,Barcelona,"['Comedy', 'Drama', 'Romance']",['Whit Stillman'],"['Taylor Nichols', 'Chris Eigeman', 'Tushka Bergen']","An American working in Barcelona, having sworn off beautiful women, is forced to be host to his playboy cousin in this witty comedy of good intentions and mixed signals.",7.0
418,Being Human,"['Comedy', 'Drama']",['Bill Forsyth'],"['Robin Williams', 'John Turturro', 'Kelly Hunter']",A mans blunders regarding his family are told and retold through different eras in history.,5.3
419,The Beverly Hillbillies,"['Comedy', 'Family']",['Penelope Spheeris'],"['Diedrich Bader', 'Erika Eleniak', 'Jim Varney']","Mild-mannered, but dirt poor hill dweller Jed Clampett strikes it rich when oil is discovered on his property. At his cousin Pearl's insistence, he moves the family to Beverly Hills to better enjoy his newfound wealth.",5.0
420,Beverly Hills Cop III,"['Action', 'Comedy', 'Crime']",['John Landis'],"['Eddie Murphy', 'Jon Tenney', 'Joey Travolta']","Axel Foley, while investigating a car theft ring, comes across something much bigger than that: the same men who killed his boss are running a counterfeit money ring out of a theme park in Los Angeles.",5.5
421,Black Beauty,"['Adventure', 'Drama', 'Family']",['Caroline Thompson'],"['Sean Bean', 'David Thewlis', 'Docs Keepin Time']","The fates of horses, and the people who own and command them, are revealed as Black Beauty narrates the circle of his life.",6.6
422,Blink,"['Crime', 'Drama', 'Mystery']",['Michael Apted'],"['Madeleine Stowe', 'Aidan Quinn', 'James Remar']","Emma, a blind violinist who had recently undergone a revolutionary surgery, joins with a police detective to track a serial killer after she was an inadvertent witness to his latest crime.",6.2
423,Blown Away,"['Action', 'Crime', 'Drama']",['Stephen Hopkins'],"['Jeff Bridges', 'Tommy Lee Jones', 'Suzy Amis']",An Irish bomber escapes from prison and targets a member of the Boston bomb squad.,6.2
424,Blue Chips,"['Drama', 'Sport']",['William Friedkin'],"['Nick Nolte', 'Mary McDonnell', 'J.T. Walsh']",A college basketball coach is forced to break the rules in order to get the players he needs to stay competitive.,6.3
425,Blue Sky,"['Drama', 'Romance']",['Tony Richardson'],"['Jessica Lange', 'Tommy Lee Jones', 'Powers Boothe']","Carly moves with her military husband and their two daughters to an isolated army base, only to quickly become part of a cover-up involving nuclear bomb tests.",6.4
